{
  "schema_version": "1.0",
  "configuration_version": "N2B1P_REPROVISION_RUNTIME_CONFIGURATION_V1",
  "status": "DRAFT_NOT_AUTHORIZED",
  "runtime_parent_ref": "OWNER_TO_PROVIDE_EXTERNAL_RUNTIME_PARENT",
  "work_root_ref": "OWNER_TO_PROVIDE_EXTERNAL_WORK_ROOT",
  "snapshot_root": "NOT_APPLICABLE_N2B1P_SOURCE_ACCESS_FORBIDDEN",
  "cache_root_ref": "OWNER_PREPROVISIONED_EXTERNAL_CACHE_ROOT",
  "quarantine_root_ref": "OWNER_IDENTIFIED_EXTERNAL_QUARANTINE_ROOT",
  "cache_root_identity": "0000000000000000000000000000000000000000000000000000000000000000",
  "configuration_digest": "0000000000000000000000000000000000000000000000000000000000000000"
}
